{
  "constraints": {
    "max_bodies_per_star": 150,
    "notes": [
      "the oil fields are the only metal-rich ground and sit behind two chokepoints",
      "major fields on borders 1 and 4: the only borders that touch no core-access region",
      "convoy wormholes pair 0-3, 2-5, 4-1 so every region has exactly one convoy"
    ],
    "symmetric": true,
    "total_planets": 56
  },
  "layout": {
    "radius_scale": 1.0,
    "shape": "ring"
  },
  "links": [
    {"chokepoint": false, "from_zone": "home_0", "lane": "normal", "to_zone": "border_0", "via_contested_planets": 0},
    {"chokepoint": false, "from_zone": "border_0", "lane": "normal", "to_zone": "home_1", "via_contested_planets": 0},
    {"chokepoint": false, "from_zone": "home_1", "lane": "normal", "to_zone": "border_1", "via_contested_planets": 0},
    {"chokepoint": false, "from_zone": "border_1", "lane": "normal", "to_zone": "home_2", "via_contested_planets": 0},
    {"chokepoint": false, "from_zone": "home_2", "lane": "normal", "to_zone": "border_2", "via_contested_planets": 0},
    {"chokepoint": false, "from_zone": "border_2", "lane": "normal", "to_zone": "home_3", "via_contested_planets": 0},
    {"chokepoint": false, "from_zone": "home_3", "lane": "normal", "to_zone": "border_3", "via_contested_planets": 0},
    {"chokepoint": false, "from_zone": "border_3", "lane": "normal", "to_zone": "home_4", "via_contested_planets": 0},
    {"chokepoint": false, "from_zone": "home_4", "lane": "normal", "to_zone": "border_4", "via_contested_planets": 0},
    {"chokepoint": false, "from_zone": "border_4", "lane": "normal", "to_zone": "home_5", "via_contested_planets": 0},
    {"chokepoint": false, "from_zone": "home_5", "lane": "normal", "to_zone": "border_5", "via_contested_planets": 0},
    {"chokepoint": false, "from_zone": "border_5", "lane": "normal", "to_zone": "home_0", "via_contested_planets": 0},
    {"chokepoint": false, "from_zone": "home_0", "lane": "wormhole", "to_zone": "convoy_0", "via_contested_planets": 0},
    {"chokepoint": false, "from_zone": "convoy_0", "lane": "normal", "to_zone": "home_3", "via_contested_planets": 0},
    {"chokepoint": false, "from_zone": "home_2", "lane": "wormhole", "to_zone": "convoy_1", "via_contested_planets": 0},
    {"chokepoint": false, "from_zone": "convoy_1", "lane": "normal", "to_zone": "home_5", "via_contested_planets": 0},
    {"chokepoint": false, "from_zone": "home_4", "lane": "wormhole", "to_zone": "convoy_2", "via_contested_planets": 0},
    {"chokepoint": false, "from_zone": "convoy_2", "lane": "normal", "to_zone": "home_1", "via_contested_planets": 0},
    {"chokepoint": true, "from_zone": "home_0", "lane": "wormhole", "to_zone": "oil_fields", "via_contested_planets": 0},
    {"chokepoint": true, "from_zone": "home_3", "lane": "wormhole", "to_zone": "oil_fields", "via_contested_planets": 0}
  ],
  "meta": {
    "description": "Six powers, one oil basin, two ways in.",
    "display_name": "Oil Chokepoint",
    "name": "oil_chokepoint",
    "players": 6,
    "seed": 1944,
    "teams": 0
  },
  "zones": [
    {"chokepoints": 0, "gated": false, "id": "home_0", "internal_links": "loop", "kind": "home", "loot": "none",
     "npc": "none", "owner_player": 0, "placement": {"kind": "ring_slot", "slot": 0}, "planet_count": 6,
     "resource_bias": "metal", "size_tiers": ["L", "M", "M", "S", "S"]},
    {"chokepoints": 0, "gated": false, "id": "home_1", "internal_links": "loop", "kind": "home", "loot": "none",
     "npc": "none", "owner_player": 1, "placement": {"kind": "ring_slot", "slot": 1}, "planet_count": 6,
     "resource_bias": "metal", "size_tiers": ["L", "M", "M", "S", "S"]},
    {"chokepoints": 0, "gated": false, "id": "home_2", "internal_links": "loop", "kind": "home", "loot": "none",
     "npc": "none", "owner_player": 2, "placement": {"kind": "ring_slot", "slot": 2}, "planet_count": 6,
     "resource_bias": "metal", "size_tiers": ["L", "M", "M", "S", "S"]},
    {"chokepoints": 0, "gated": false, "id": "home_3", "internal_links": "loop", "kind": "home", "loot": "none",
     "npc": "none", "owner_player": 3, "placement": {"kind": "ring_slot", "slot": 3}, "planet_count": 6,
     "resource_bias": "metal", "size_tiers": ["L", "M", "M", "S", "S"]},
    {"chokepoints": 0, "gated": false, "id": "home_4", "internal_links": "loop", "kind": "home", "loot": "none",
     "npc": "none", "owner_player": 4, "placement": {"kind": "ring_slot", "slot": 4}, "planet_count": 6,
     "resource_bias": "metal", "size_tiers": ["L", "M", "M", "S", "S"]},
    {"chokepoints": 0, "gated": false, "id": "home_5", "internal_links": "loop", "kind": "home", "loot": "none",
     "npc": "none", "owner_player": 5, "placement": {"kind": "ring_slot", "slot": 5}, "planet_count": 6,
     "resource_bias": "metal", "size_tiers": ["L", "M", "M", "S", "S"]},
    {"chokepoints": 0, "gated": false, "id": "border_0", "internal_links": "tree", "kind": "border", "loot": "none",
     "npc": "none", "placement": {"kind": "between", "zones": ["home_0", "home_1"]}, "planet_count": 1,
     "resource_bias": "crystal", "size_tiers": ["M"]},
    {"chokepoints": 0, "gated": false, "id": "border_1", "internal_links": "tree", "kind": "border", "loot": "none",
     "npc": "none", "placement": {"kind": "between", "zones": ["home_1", "home_2"]}, "planet_count": 2,
     "resource_bias": "balanced", "size_tiers": ["L", "L"]},
    {"chokepoints": 0, "gated": false, "id": "border_2", "internal_links": "tree", "kind": "border", "loot": "none",
     "npc": "none", "placement": {"kind": "between", "zones": ["home_2", "home_3"]}, "planet_count": 1,
     "resource_bias": "crystal", "size_tiers": ["M"]},
    {"chokepoints": 0, "gated": false, "id": "border_3", "internal_links": "tree", "kind": "border", "loot": "none",
     "npc": "none", "placement": {"kind": "between", "zones": ["home_3", "home_4"]}, "planet_count": 1,
     "resource_bias": "crystal", "size_tiers": ["M"]},
    {"chokepoints": 0, "gated": false, "id": "border_4", "internal_links": "tree", "kind": "border", "loot": "none",
     "npc": "none", "placement": {"kind": "between", "zones": ["home_4", "home_5"]}, "planet_count": 2,
     "resource_bias": "balanced", "size_tiers": ["L", "L"]},
    {"chokepoints": 0, "gated": false, "id": "border_5", "internal_links": "tree", "kind": "border", "loot": "none",
     "npc": "none", "placement": {"kind": "between", "zones": ["home_5", "home_0"]}, "planet_count": 1,
     "resource_bias": "crystal", "size_tiers": ["M"]},
    {"chokepoints": 0, "gated": false, "id": "convoy_0", "internal_links": "tree", "kind": "contested", "loot": "none",
     "npc": "none", "placement": {"kind": "between", "zones": ["home_0", "home_3"]}, "planet_count": 1,
     "resource_bias": "balanced", "size_tiers": ["S"]},
    {"chokepoints": 0, "gated": false, "id": "convoy_1", "internal_links": "tree", "kind": "contested", "loot": "none",
     "npc": "none", "placement": {"kind": "between", "zones": ["home_2", "home_5"]}, "planet_count": 1,
     "resource_bias": "balanced", "size_tiers": ["S"]},
    {"chokepoints": 0, "gated": false, "id": "convoy_2", "internal_links": "tree", "kind": "contested", "loot": "none",
     "npc": "none", "placement": {"kind": "between", "zones": ["home_4", "home_1"]}, "planet_count": 1,
     "resource_bias": "balanced", "size_tiers": ["S"]},
    {"chokepoints": 2, "gated": true, "id": "oil_fields", "internal_links": "loop", "kind": "core", "loot": "none",
     "npc": "none", "placement": {"kind": "center"}, "planet_count": 5, "resource_bias": "metal",
     "size_tiers": ["L", "L", "XL", "L", "L"],
     "slot_biases": ["metal", "metal", "balanced", "metal", "metal"]},
    {"chokepoints": 0, "gated": false, "id": "filler", "internal_links": "tree", "kind": "filler", "loot": "none",
     "npc": "none", "placement": {"kind": "gap"}, "planet_count": 2, "resource_bias": "balanced",
     "size_tiers": ["S", "M"]},
    {"chokepoints": 0, "gated": false, "id": "pirates", "internal_links": "tree", "kind": "pirate", "loot": "none",
     "npc": "pirate", "placement": {"kind": "gap"}, "planet_count": 2, "resource_bias": "none", "size_tiers": []}
  ]
}
